<?xml version="1.0" encoding="UTF-8"?>
<tns:SubmissionData xsi:schemaLocation='http://gov.hud.arm/client_profile_databag_5_0 client_profile_databag_5_0.xsd' xmlns:tns='http://gov.hud.arm/client_profile_databag_5_0' xmlns:xsi='http://www.w3.org/2001/XMLSchema-instance'>
	<tns:Client_Profiles>
		<tns:Client_Profile>
			<tns:Client_ID_Num>187654321</tns:Client_ID_Num>
			<tns:Client_Case_Num>1234567891</tns:Client_Case_Num>
			<tns:Client_SSN1>123-45-6789</tns:Client_SSN1>
			<tns:Client_SSN2>1234</tns:Client_SSN2>
			<tns:Client_First_Name>aaaaaaaaaaaaaaa</tns:Client_First_Name>
			<tns:Client_Last_Name>aaaaaaaaaaaaaaa</tns:Client_Last_Name>
			<tns:Client_Middle_Name>aaaaaaaaaaaaaaa</tns:Client_Middle_Name>
			<tns:Client_Street_Address_1>aaaaaaaaaaaaaaa</tns:Client_Street_Address_1>
			<tns:Client_Street_Address_2>aaaaaaaaaaaaaaa</tns:Client_Street_Address_2>
			<tns:Client_City>aaaaaaaaaaaaaaa</tns:Client_City>
			<tns:Client_State>12</tns:Client_State>
			<tns:Client_Zip>00001</tns:Client_Zip>
			<tns:Client_New_Street_Address_1>aaaaaaaaaaaaaaa</tns:Client_New_Street_Address_1>
			<tns:Client_New_Street_Address_2>aaaaaaaaaaaaaaa</tns:Client_New_Street_Address_2>
			<tns:Client_New_City>aaaaaaaaaaaaaaa</tns:Client_New_City>
			<tns:Client_New_State>12</tns:Client_New_State>
			<tns:Client_New_Zip>00001</tns:Client_New_Zip>
			<tns:Client_Phone_Num>703-555-1212x12345</tns:Client_Phone_Num>
			<tns:Client_Mobile_Phone_Num>703-000-1234</tns:Client_Mobile_Phone_Num>
			<tns:Client_Fax>703-123-4567</tns:Client_Fax>
			<tns:Client_Email>aaaaa@aaaaaaaaaa.us</tns:Client_Email>
			<tns:Client_Family_Size>1</tns:Client_Family_Size>
			<tns:Client_Gender>M</tns:Client_Gender>
			<tns:Client_Marital_Status>7</tns:Client_Marital_Status>
			<tns:Client_Race_ID>12</tns:Client_Race_ID>
			<tns:Client_Ethnicity_ID>4</tns:Client_Ethnicity_ID>
			<tns:Client_Household_Gross_Monthly_Income>12</tns:Client_Household_Gross_Monthly_Income>
			<tns:Client_Head_Of_Household_Type>1</tns:Client_Head_Of_Household_Type>
			<tns:Client_Birth_DT>11-30-1999</tns:Client_Birth_DT>
			<tns:Client_Counselor_ID>256</tns:Client_Counselor_ID>
			<tns:Client_Highest_Educ_Grade>4</tns:Client_Highest_Educ_Grade>
			<tns:Client_Farm_Worker>Y</tns:Client_Farm_Worker>
			<tns:Client_Rural_Area>1</tns:Client_Rural_Area>
			<tns:Client_Limited_English_Proficiency>2</tns:Client_Limited_English_Proficiency>
			<tns:Client_Colonias_Resident>N</tns:Client_Colonias_Resident>
			<tns:Client_HUD_Assistance>8</tns:Client_HUD_Assistance>
			<tns:Client_Disabled>Y</tns:Client_Disabled>
			<tns:Client_Dependents_Num>1</tns:Client_Dependents_Num>
			<tns:Client_Intake_DT>11-30-1999</tns:Client_Intake_DT>
			<tns:Client_Counsel_Start_Session_DateTime>11-30-1999 12:56</tns:Client_Counsel_Start_Session_DateTime>
			<tns:Client_Counsel_End_Session_DateTime>11-30-1999 12:56</tns:Client_Counsel_End_Session_DateTime>
			<tns:Client_Language_Spoken>2</tns:Client_Language_Spoken>
			<tns:Client_Session_Duration>2</tns:Client_Session_Duration>
			<tns:Client_Counseling_Type>2</tns:Client_Counseling_Type>
			<tns:Client_Counseling_Termination>2</tns:Client_Counseling_Termination>
			<tns:Client_Counseling_Fee>3</tns:Client_Counseling_Fee>
			<tns:Client_Attribute_HUD_Grant>3</tns:Client_Attribute_HUD_Grant>	
			<tns:Client_Grant_Amount_Used>10000.00</tns:Client_Grant_Amount_Used>
			<tns:Client_HECM_Certificate>Y</tns:Client_HECM_Certificate>
			<tns:Client_HECM_Certificate_Issue_Date>11-30-1999</tns:Client_HECM_Certificate_Issue_Date>
			<tns:Client_HECM_Certificate_Expiration_Date>11-30-1999</tns:Client_HECM_Certificate_Expiration_Date>
			<tns:Client_HECM_Certificate_ID>12345678</tns:Client_HECM_Certificate_ID>
			<tns:Client_Predatory_Lending>Y</tns:Client_Predatory_Lending>
			<tns:Client_Mortgage_Type>11</tns:Client_Mortgage_Type>
			<tns:Client_Mortgage_Type_After>5</tns:Client_Mortgage_Type_After>
			<tns:Client_Finance_Type_Before>6</tns:Client_Finance_Type_Before>
			<tns:Client_Finance_Type_After>11</tns:Client_Finance_Type_After>
			<tns:Client_FirstTime_Home_Buyer>Y</tns:Client_FirstTime_Home_Buyer>
			<tns:Client_Discrimination_Victim>N</tns:Client_Discrimination_Victim>
			<tns:Client_Mortgage_Closing_Cost>123</tns:Client_Mortgage_Closing_Cost>
			<tns:Client_Mortgage_Interest_Rate>0.456</tns:Client_Mortgage_Interest_Rate>
			<tns:Client_Referred_By>2</tns:Client_Referred_By>
			<tns:Client_Sales_Contract_Signed>11-30-1999</tns:Client_Sales_Contract_Signed>
			<tns:Client_Credit_Score>500</tns:Client_Credit_Score>
			<tns:Client_Credit_Score_Source>1</tns:Client_Credit_Score_Source>
			<tns:Client_Job_Duration>1</tns:Client_Job_Duration>
			<tns:Client_Household_Debt>1</tns:Client_Household_Debt>
			<tns:Client_Mortgage_Deliquency>Y</tns:Client_Mortgage_Deliquency>
			<tns:Client_Spouse_First_Name>aaaaaaaaaaaaaaa</tns:Client_Spouse_First_Name>
			<tns:Client_Spouse_Last_Name>aaaaaaaaaaaaaaa</tns:Client_Spouse_Last_Name>
			<tns:Client_Spouse_Middle_Name>aaaaaaaaaaaaaaa</tns:Client_Spouse_Middle_Name>
			<tns:Client_Spouse_SSN>123-45-6789</tns:Client_Spouse_SSN>
			<tns:Client_Loan_Being_Reported>F</tns:Client_Loan_Being_Reported>
			<tns:Client_Second_Loan_Exists>N</tns:Client_Second_Loan_Exists>
			<tns:Client_Intake_Loan_Type>7</tns:Client_Intake_Loan_Type>
			<tns:Client_Intake_Loan_Type_Is_Hybrid_ARM>N</tns:Client_Intake_Loan_Type_Is_Hybrid_ARM>
			<tns:Client_Intake_Loan_Type_Is_Option_ARM>Y</tns:Client_Intake_Loan_Type_Is_Option_ARM>
			<tns:Client_Intake_Loan_Type_Is_Interest_Only>Y</tns:Client_Intake_Loan_Type_Is_Interest_Only>
			<tns:Client_Intake_Loan_Type_Is_FHA_Or_VA_Insured>N</tns:Client_Intake_Loan_Type_Is_FHA_Or_VA_Insured>
			<tns:Client_Intake_Loan_Type_Is_Privately_Held>N</tns:Client_Intake_Loan_Type_Is_Privately_Held>
			<tns:Client_Intake_Loan_Type_Has_Interest_Rate_Reset>Y</tns:Client_Intake_Loan_Type_Has_Interest_Rate_Reset>
			<tns:Client_Income_Level>8</tns:Client_Income_Level>
			<tns:Client_Purpose_Of_Visit>6</tns:Client_Purpose_Of_Visit>
			<tns:Client_Activity_Type>4</tns:Client_Activity_Type>
		</tns:Client_Profile>
	</tns:Client_Profiles>
</tns:SubmissionData>